序号,一级指标,二级指标,三级指标,对应指引条目,指标类型,分值,适用对象,自评分结果,工商联评分结果
1,党建引领,组织建设,党组织是否依法依规建立（有三名以上正式党员、条件成熟的企业，要单独建立党的组织；暂不具备单独组建党组织条件的，可联合组建区域性党组织、行业性党组织，实现党的组织覆盖。）,第十条,合规项,0.5,所有企业,,
2,,,企业党组织是否按要求执行党的组织生活制度,第十五条,合规项,0.5,所有企业,,
3,,,企业是否为党组织活提供活动经费和场所,第十七条,合规项,0.5,所有企业,,
4,,政治引领,党组织是否存在引导和监督企业遵守法律法规的行为,第十一条,有效项,-10.0,所有企业,,
5,,,党组织是否在企业内宣传贯彻党的路线方针政策,,合规项,0.5,所有企业,,
6,,党建参与治理,企业章程中是否明确党组织功能和定位,第九条,有效项,0.5,所有企业,,
7,,,党组织是否参与协调企业与政府、员工等多方关系,第十二条,有效项,0.5,所有企业,,
8,,员工凝聚与群团建设,党组织是否积极联系员工、维护员工权益、化解员工矛盾,第十三条,有效项,0.5,所有企业,,
9,,,企业是否规范规范党员组织关系接转,第十六条,调节项,-10.0,所有企业,,
10,产权结构,权属清晰,企业的工商登记信息是否与实际出资情况保持一致？,第十九条,合规项,0.5,所有企业,,
11,,,企业是否留存股东认缴和实缴出资的凭证，以及股权转让、赠与、继承、分割等继受取得股权的材料？,,合规项,0.5,公司制企业,,
12,,,企业是否向股东签发出资证明书，且要素齐全、签章有效？,第二十条,合规项,0.5,有限责任公司,,
13,,,企业是否向股东正式交付股票，并准确记载于股东名册？,,合规项,0.5,股份有限公司,,
14,,,企业在股东出资新设或股权发生变更后，是否置备并及时更新股东名册，并依法办理股权变更登记？,,合规项,0.5,公司制企业,,
15,,,当股东名册缺失或不规范时，企业是否通过公司章程、会议纪要等书面文件明确并认可新股东身份？,,合规项,0.5,公司制企业,,
16,,,企业在章程或股东协议中，是否设有股东权利受侵害时的争议解决机制（如仲裁、诉讼条款）？,第二十一条,有效项,0.5,公司制企业,,
17,,,企业是否在中国人民银行受益所有人信息管理系统中完成受益所有人信息备案？,第二十二条,合规项,0.5,所有企业,,
18,,,企业是否可通过章程、股东协议、股东名册、股权登记或其他合规文件，清晰识别控股股东和实际控制人？,,合规项,0.5,所有企业,,
19,,,企业的章程或股东协议是否规定了股权转让规则（如优先购买权条件、价格评估方式、受让方资格限制等）？,第二十三条,有效项,0.5,公司制企业,,
20,,,企业的章程或股东协议是否规定了股东退出机制（如股权回购、协议转让、司法拍卖等）？,,有效项,0.5,公司制企业,,
21,,,企业设立或吸收新股东时，是否对出资方的征信、经营状况、商业道德及出资能力开展尽职调查？,第二十四条,合规项,0.5,所有企业,,
22,,,企业存在股权代持情形的，是否签署代持协议、完成合规备案，并在受益所有人系统同步登记？,第二十五条,合规项,0.5,公司制企业,,
23,,,企业存在股权代持情形的，是否符合外商投资法及实施条例关于投资准入特别管理措施的规定？,,合规项,0.5,外商投资企业,,
24,,,企业在以股权进行让与担保融资时，是否签署规范合同并依法办理股权质押登记与信息备案？,第二十六条,合规项,0.5,公司制企业,,
25,,法人财产独立与保护,企业是否建立防范股东抽逃出资的内部财务控制制度，并在近三年未发生抽逃出资情形？,第二十七条,调节项,-10.0,公司制企业,,
26,,,企业是否在公司章程或内部制度中，明确界定公司法人财产与股东个人或家族财产的边界？,第二十八条,合规项,0.5,公司制企业,,
27,,,企业是否建立资产清单并定期更新，且每年至少进行一次全面的资产盘点和财务审计？,,合规项,0.5,公司制企业,,
28,,,企业是否建立独立的财务账户体系，并严格禁止使用股东、实际控制人、董监高等个人账户进行企业收支结算？,第二十九条,合规项,0.5,公司制企业,,
29,,,企业是否按照国家统一会计制度或公司章程，定期（至少每年一次）编制并向股东披露财务报表（至少包括资产负债表、利润表、现金流量表）？,,合规项,0.5,所有企业,,
30,,,企业是否建立核心资产登记管理制度，涵盖专利、商标、不动产、股权等，并定期（至少每年一次）开展权属核查和瑕疵补正？,第三十条,合规项,0.5,公司制企业,,
31,,,企业是否建立数据资源台账，并开展数据资源持有权、使用权、经营权确权登记？,第三十一条,有效项,0.5,所有企业,,
32,,,企业是否将符合条件的数据资源入表，分类计量并在财务报表中列示披露？,,有效项,0.5,所有企业,,
33,,,企业是否建立境外资产核算与风险管控制度，遵守我国外汇及安全审查规定？,第三十二条,合规项,0.5,所有企业,,
34,,,企业的境外子公司是否按所在国会计准则独立建账，并每年至少一次向母公司提交经审计或复核的财务报告？,,合规项,0.5,公司制企业,,
35,,,企业是否建立针对被查封、冻结、扣押资产的应急保护机制？,第三十三条,有效项,0.5,所有企业,,
36,,,企业是否制定破产保护或重整预案，明确触发条件、内部决策流程及责任分工？,第三十四条,有效项,0.5,所有企业,,
37,,,企业是否与地方工商联、行业协会、律师事务所等外部支持机构建立沟通渠道，以获得产权保护方面的支持？,第三十五条,有效项,0.5,所有企业,,
38,,,企业近三年内是否基于经营需要评估或调整过注册资本？,第三十六条,有效项,0.5,所有企业,,
39,,股权结构合理,企业是否每年更新并核查其关联企业清单，并建立关联企业退出机制？,第三十八条,有效项,0.5,所有企业,,
40,,,企业的股权层级是否控制在四级以内？,第三十九条,合规项,0.5,公司制企业,,
41,,,企业是否实施创新股权结构（如双层股权、动态股权、虚拟股权、限制性股权、期权、家族信托等）？,第四十条,有效项,0.5,所有企业,,
42,,,企业在过去三年内是否引入战略投资者、财务投资者或产业投资者等外部机构投资者？,第四十一条,有效项,0.5,所有企业,,
43,,,企业是否实施员工持股计划？,第四十二条,有效项,0.5,所有企业,,
44,,,企业是否制定股份制改革、挂牌孵化或上市的计划？,第四十三条,有效项,0.5,公司制企业,,
45,公司治理结构和机制,股东会治理,公司所有股东的各项权利是否都能得到保障？股东权利见《指引》第四十四条,第四十四条,合规项,0.5,有限责任公司、非上市股份有限公司、上市股份有限公司,,
46,,,公司所有股东是否都已尽到了义务？股东义务见《指引》第四十四条,第四十四条,合规项,0.5,有限责任公司、非上市股份有限公司、上市股份有限公司,,
47,,,近三年，公司股东会是否行使了《指引》列举职权中的6项及以上？股东会职权见《指引》第四十五条,第四十五条,有效项,0.5,有限责任公司、非上市股份有限公司、上市股份有限公司,,
48,,,公司是否在章程模板的基础上进行了个性化修改，或者股东是否签订了股东协议？,第四十七条,有效项,0.5,有限责任公司、非上市股份有限公司、上市股份有限公司,,
49,,,公司是否制定了股东会、董事会、监事会议事规则中的2项及以上？,第四十八条,有效项,0.5,有限责任公司、非上市股份有限公司、上市股份有限公司,,
50,,,上一年度，公司是否召开了1次及以上股东会会议？,第四十九条,有效项,0.5,有限责任公司、非上市股份有限公司、上市股份有限公司,,
51,,,公司是否于股东会会议召开十五日前通知全体股东？,公司法第六十四、一百一十五条,合规项,0.5,有限责任公司、非上市股份有限公司、上市股份有限公司,,
52,,,公司是否留存了完整的股东会会议记录？,第五十一条,合规项,0.5,有限责任公司、非上市股份有限公司、上市股份有限公司,,
53,,,公司章程是否规定了股东会对董事会的授权原则或具体内容？,第五十二条,有效项,0.5,有限责任公司、非上市股份有限公司、上市股份有限公司,,
54,,,公司控股股东、实际控制人是否存在滥用股东权利损害公司利益、违规操作控制公司等情况？,规范股东行为1,调节项,-10.0,有限责任公司、非上市股份有限公司、上市股份有限公司,,
55,,,公司是否建立了利害关系股东的表决权排除制度？,规范股东行为2,有效项,0.5,有限责任公司、非上市股份有限公司、上市股份有限公司,,
56,,,公司股东会选举董事、监事，是否实行了累积投票制？,规范股东行为2,有效项,0.5,非上市股份有限公司、上市股份有限公司,,
57,,,公司是否与控股股东、实际控制人及关联公司存在人员、资产、财务混同？,规范股东行为3,有效项,0.5,有限责任公司、非上市股份有限公司、上市股份有限公司,,
58,,,公司是否每年向股东说明董事、监事、高级管理人员从公司获得报酬的情况？,规范董事、监事和高级管理人员行为1,有效项,0.5,有限责任公司、非上市股份有限公司、上市股份有限公司,,
59,,董事会治理,上一年度，公司董事会是否行使了《指引》列举职权中的10项及以上？董事会职权见《指引》第五十八条。,第五十八条,有效项,0.5,有限责任公司、非上市股份有限公司、上市股份有限公司,,
60,,,公司董事会的规模是否有3人及以上？,第五十九条,有效项,0.5,有限责任公司、非上市股份有限公司、上市股份有限公司,,
61,,,公司是否在章程中规定了规范、透明的选聘程序以及董事长、副董事长的产生办法？,第五十九、六十条,有效项,0.5,有限责任公司、非上市股份有限公司、上市股份有限公司,,
62,,,公司董事是否有3个及以上不同的专业背景，且专业背景包括财务会计？,第六十一条,有效项,0.5,有限责任公司、非上市股份有限公司、上市股份有限公司,,
63,,,公司董事的跨公司兼任数量是否不超过3个？,第六十二条,有效项,0.5,有限责任公司、非上市股份有限公司、上市股份有限公司,,
64,,,上一年度，董事会是否召开了2次及以上董事会会议？,第六十三条,有效项,0.5,有限责任公司、非上市股份有限公司、上市股份有限公司,,
65,,,上一年度，董事会会议是否均由董事本人出席？,第六十四条,有效项,0.5,有限责任公司、非上市股份有限公司、上市股份有限公司,,
66,,,近三年，董事会会议记录是否完整且有出席会议的董事签名？,第六十五条,合规项,0.5,有限责任公司、非上市股份有限公司、上市股份有限公司,,
67,,,上一年度，公司是否为全体董事提供了4次及以上的公司信息？,第六十六条,有效项,0.5,有限责任公司、非上市股份有限公司、上市股份有限公司,,
68,,,公司是否安排了专人负责股东会和董事会会议的筹备和文件保管以及股东资料管理、公司信息报送等工作？,第六十六条,有效项,0.5,有限责任公司、非上市股份有限公司、上市股份有限公司,,
69,,,公司章程中是否明确了董事会对董事长和高级管理人员的授权内容？,第六十七条,有效项,0.5,有限责任公司、非上市股份有限公司、上市股份有限公司,,
70,,,公司是否引入了外部董事或独立董事制度？,第七十条,有效项,0.5,有限责任公司、非上市股份有限公司、上市股份有限公司,,
71,,,外部董事或独立董事是否会对公司经营中的潜在利益冲突进行专项审查并形成报告？,第七十条,有效项,0.5,有限责任公司、非上市股份有限公司、上市股份有限公司,,
72,,,公司董事会是否设立了2个及以上的董事会专门委员会？,第六十八条,有效项,0.5,有限责任公司、非上市股份有限公司、上市股份有限公司,,
73,,,公司如设立审计委员会、提名委员会、薪酬与考核委员会，其中外部董事或独立董事是否占多数？,第六十八条,有效项,0.5,有限责任公司、非上市股份有限公司、上市股份有限公司,,
74,,,公司如设审计委员会，其召集人是否为财务与会计专业人士？,第六十八条,有效项,0.5,有限责任公司、非上市股份有限公司、上市股份有限公司,,
75,,,有子公司的，是否明确了对子公司的管控模式以及母子公司的权责边界？管控模式见《指引》集团公司治理部分。,第七十一条,有效项,0.5,有限责任公司、非上市股份有限公司、上市股份有限公司,,
76,,高级管理人员与法定代表人,公司经理是否对董事会负责？,第七十二条,合规项,0.5,有限责任公司、非上市股份有限公司、上市股份有限公司,,
77,,,公司是否在章程或其他制度中规定了高级管理人员的职责？,第七十二条,有效项,0.5,有限责任公司、非上市股份有限公司、上市股份有限公司,,
78,,,公司经理是否行使了《指引》列举职权中的6项及以上？经理职权见《指引》第七十二条。,第七十二条,有效项,0.5,有限责任公司、非上市股份有限公司、上市股份有限公司,,
79,,,公司是否由控股股东、实际控制人及其关联方直接负责高级管理人员的选聘？,第七十三条,调节项,-10.0,有限责任公司、非上市股份有限公司、上市股份有限公司,,
80,,,公司是否在章程中载明了法定代表人的产生、变更办法？,第七十四条,有效项,0.5,有限责任公司、非上市股份有限公司、上市股份有限公司,,
81,,,公司法定代表人是否行使了《指引》列举的股东会和董事会职权中的1项及以上？,第七十六条,调节项,-10.0,有限责任公司、非上市股份有限公司、上市股份有限公司,,
82,,监事会/审计委员会治理,公司监事会中是否包括职工监事，如由审计委员会履行监事会的职权，审计委员会中是否包括职工董事？,第七十七条,有效项,0.5,有限责任公司、非上市股份有限公司、上市股份有限公司,,
83,,,公司监事会或者由审计委员会履行监事会职权的审计委员会，是否行使了《指引》列举职权中的2项及以上？监事会职权见《指引》第七十八条。,第七十八条,有效项,0.5,有限责任公司、非上市股份有限公司、上市股份有限公司,,
84,,,公司监事会或者由审计委员会履行监事会职权的审计委员会，是否要求全部董事、高级管理人员提交了执行职位的报告？,第七十八条,有效项,0.5,有限责任公司、非上市股份有限公司、上市股份有限公司,,
85,,,公司监事或者由审计委员会履行监事会职权的审计委员会董事，是否均具备10年及以上的工作经验？,第七十九条,有效项,0.5,有限责任公司、非上市股份有限公司、上市股份有限公司,,
86,,,上一年度，公司监事会或者由审计委员会履行监事会职权的审计委员会，是否召开了符合规定次数的会议？（有限责任公司1次及以上，股份有限公司2次及以上）,第八十条,合规项,0.5,有限责任公司、非上市股份有限公司、上市股份有限公司,,
87,,董事、监事和高级管理人员,为规范履职，公司是否为董事、监事、高级管理人员建立了股权锁定、离任审计、触发式退出、竞业禁止等制度？,规范董事、监事和高级管理人员行为1,有效项,0.5,有限责任公司、非上市股份有限公司、上市股份有限公司,,
88,,,公司是否为董事、监事、高级管理人员明确了忠实义务和勤勉义务的具体标准？,规范董事、监事和高级管理人员行为2,有效项,0.5,有限责任公司、非上市股份有限公司、上市股份有限公司,,
89,,,公司是否在章程中规定或在股东会决议中明确了包括相应标准的董事、监事、高级管理人员问责免责制度？,规范董事、监事和高级管理人员行为4,有效项,0.5,有限责任公司、非上市股份有限公司、上市股份有限公司,,
90,,,公司是否建立了董事、监事、高级管理人员的履职评价体系？,规范董事、监事和高级管理人员行为5,有效项,0.5,有限责任公司、非上市股份有限公司、上市股份有限公司,,
91,战略管理,战略规划与决策,企业是否制定成文的中长期（三年及以上）发展战略规划？,第八十一条,合规项,0.5,所有企业,,
92,,,企业是否通过章程或制度，明确划分股东会、董事会、经理层在战略制定与执行中的职责与决策权限？,第八十二条,合规项,0.5,公司制企业,,
93,,,企业董事会是否下设战略（与决策）委员会，并实际开展战略研讨工作？,,有效项,0.5,公司制企业,,
94,,,企业近三年的战略调整事项，是否均经股东会、董事会集体决策并留存会议纪要或决议？,第八十六条,调节项,-10.0,公司制企业,,
95,,战略导向,企业战略规划中是否包含与国家、省市级“十四五”或“十五五”规划、重大区域战略相衔接的内容？,第八十三条,合规项,0.5,所有企业,,
96,,,企业近三年战略规划或重大投资事项中，是否包含《产业结构调整指导目录》中的鼓励类项目？,第八十四条,合规项,0.5,所有企业,,
97,,,企业是否有明文规定禁止投资《产业结构调整指导目录》中的限制类、淘汰类项目？,,调节项,0.5,所有企业,,
98,,,企业的战略规划是否明确界定主业，研发、资金等要素投入是否主要集中于主业和战略性新兴产业？,第八十五条,合规项,0.5,所有企业,,
99,,战略执行与评估,企业是否制定与战略目标相匹配的年度计划、投资计划与财务预算，并建立与绩效考核的联动机制？,第八十七条,有效项,0.5,所有企业,,
100,,,企业近一年内是否根据内外部环境变化对战略执行情况进行评估，并据此对战略规划进行调整？,第八十八条,合规项,0.5,所有企业,,
101,,,企业是否应用信息化系统或数据分析工具来支持战略决策和执行监控？,第八十九条,有效项,0.5,所有企业,,
102,内控、风险与合规管理,制度建设,是否运用信息技术手段，建立集财务、审计、风险预警为一体的管理信息系统,第九十四条,有效项,0.5,所有企业,,
103,,,是否建立覆盖财务、人事、采购、投资、运营等环节的内控制度,第九十三条,合规项,0.5,公司制企业,,
104,,,是否制定关联交易管理制度及审查机制，要求控股股东、实际控制人及董监高向公司报送关联方名单、关联关系及变化情况的说明,第一百零六条,合规项,0.5,公司制企业,,
105,,,是否建立实施绩效考评制度，对内部各责任单位和全体员工业绩进行定期考核评价，并将考评结果作为员工薪酬、职务晋升、评级评优、调岗辞退等的依据,第一百零四条,有效项,0.5,所有企业,,
106,,,是否明确预算管理体制以及各预算执行单位的职责权限,第一百零二条,有效项,0.5,所有企业,,
107,,,制度是否定期更新、修订并经过董事会/监事会审议,第九十条,合规项,0.5,公司制企业,,
108,,问责机制,是否建立违规行为追责问责机制？做到明确责任范围，细化问责标准，针对问题和线索及时展开调查。,第九十六条,调节项,-10.0,所有企业,,
110,,,是否建立问责清单动态管理机制，结合行业特性、监管要求及企业发展阶段，定期评估并调整问责范围、标准及程序,第九十八条,有效项,0.5,所有企业,,
111,,,针对重点领域制定专项问责细则，明确具体问责情形、认定标准及处置措施,第九十九条,有效项,0.5,所有企业,,
112,,调查及举报机制,是否建立反舞弊举报调查机制，设立违规举报平台，公布举报电话、邮箱或者信箱，确保举报渠道畅通且易于使用,第九十五条,合规项,0.5,所有企业,,
113,,,有无保留有关调查的文件化信息，定期向治理机构或最高管理者报告调查的次数和结果,,合规项,0.5,所有企业,,
114,,,接受匿名举报，对举报人的身份和举报事项严格保密，对举报属实的举报人，给予适当奖励，防范举报人被打击报复,第九十六条,合规项,0.5,所有企业,,
115,,权力规范,企业重大决策、重大事项、重要人事任免及大额资金支付业务事项是否实行集体决策审批或者联签制度,第一百零一条,有效项,0.5,所有企业,,
116,,,是否按照不相容职务分离控制、分级授权审批控制、决策执行监督相分离等内控体系管控方法，严格规范重要岗位和关键人员在授权、审批、执行、报告等方面的权责,第一百零一条,合规项,0.5,所有企业,,
117,,财务与资产控制,是否建立财产日常管理制度和定期清查盘点制度,第一百零三条,合规项,0.5,所有企业,,
118,,,是否严格执行会计法、会计准则及国家统一的财务会计制度,第一百零五条,调节项,-10.0,所有企业,,
120,,内部审计,有无内部审计制度、设立内部审计机构（人员），并对公司业务活动、风险管理、内部控制、财务信息等事项进行监督检查,第一百零七条,有效项,0.5,所有企业,,
121,,,是否对审计发现问题进行整改跟踪,,合规项,0.5,所有企业,,
122,,外部监督,是否聘请独立审计机构进行年度审计,第一百零八条,有效项,0.5,所有企业,,
123,,,是否披露审计意见（无保留/带强调事项/否定/无法表示意见）,,有效项,0.5,所有企业,,
124,,风险管理,是否建立内部风险防控和风险预警机制，将风险防控各项要求嵌入经营管理各环节,第一百零九条,有效项,0.5,所有企业,,
127,,,是否将风险审查作为重大决策、重大项目、重大合同、重大资金支付以及新业务、新模式、新技术的必经前置程序，确保重大决策事项均经过充分的风险评估,第一百一十四条,有效项,0.5,所有企业,,
128,,合规管理,是否将合规审查设为全部业务流程的必经环节,第一百二十一条,调节项,-10.0,所有企业,,
129,,,是否定期开展合规管理绩效评价（聚焦风险管控措施执行）、合规管理体系有效性评价（聚焦体系运行质量）、管理评审（聚焦重大事项改进决策）,第一百二十二条,有效项,0.5,所有企业,,
130,,,是否建立常态化合规培训机制,第一百二十三条,有效项,0.5,所有企业,,
131,,,是否将“亲”“清”原则固化为制度，规范政商行为,第一百二十四条,合规项,0.5,所有企业,,
132,,,处理数据过程中是否遵守相关合规制度,第一百二十六条,合规项,0.5,所有企业,,
133,科学民主管理,科学管理,企业是否通过ISO9001质量管理体系、ISO14001环境管理体系等国际标准认证，并建立相应的管理制度文件？,第一二七条,有效项,0.5,所有企业,,
134,,,企业是否建立人力资源管理部门，制定员工手册并实施标准化的招聘、培训、考核、晋升等制度？,第一二八条,合规项,0.5,所有企业,,
135,,,企业是否建立数据管理制度，对企业数据进行分类分级管理并设置相应的访问权限？,第一二九条,合规项,0.5,所有企业,,
136,,,企业是否设立安全生产管理部门，制定年度安全培训计划并定期开展应急演练活动？,第一三〇条,合规项,0.5,所有企业,,
137,,,企业是否建立产品质量检验制度，设置质量控制关键节点并建立不合格品召回处理机制？,第一三一条,合规项,0.5,所有企业,,
138,,,企业是否注册企业商标，设立专门的客户服务部门并制定客户投诉处理流程？,第一三二条,合规项,0.5,所有企业,,
139,,,企业是否建立合格供应商名录管理制度，对主要供应商进行资质审核和年度评估？,第一三三条,有效项,0.5,所有企业,,
140,,,互联网平台类企业是否建立平台商家准入审核机制，对入驻商家进行身份验证和信息公示？,第一三四条,合规项,0.5,互联网平台企业,,
141,,员工权益保障,企业是否建立劳动合同管理台账，确保所有员工在入职一个月内签订书面劳动合同？,第一三五条,合规项,0.5,所有企业,,
142,,,企业是否为所有员工开设社保账户，按月足额缴纳养老、医疗、工伤、失业、生育五项社会保险？,第一三六条,合规项,0.5,所有企业,,
143,,,企业是否建立工资发放管理制度，设置固定的工资发放日并保证按时足额支付？,第一三七条,合规项,0.5,所有企业,,
144,,,企业是否建立考勤管理系统，对超时工作依法支付加班费并保障员工年休假权利？,第一三八条,合规项,0.5,所有企业,,
